{
  "canonical_url": "https://westkitty.github.io/Starsilk_Character_Dossier/relationships/",
  "connected_entity_count": 62,
  "entities": [
    {
      "canonical_url": "https://westkitty.github.io/Starsilk_Character_Dossier/entities/cover/",
      "display_label": "Starsilk Compendium",
      "incoming_count": 0,
      "observatory_url": "https://westkitty.github.io/Starsilk_Character_Dossier/relationships/#entity-cover",
      "outgoing_count": 9,
      "stable_id": "cover"
    },
    {
      "canonical_url": "https://westkitty.github.io/Starsilk_Character_Dossier/entities/world/",
      "display_label": "The All is programmable. Meaning is not optional.",
      "incoming_count": 0,
      "observatory_url": "https://westkitty.github.io/Starsilk_Character_Dossier/relationships/#entity-world",
      "outgoing_count": 1,
      "stable_id": "world"
    },
    {
      "canonical_url": "https://westkitty.github.io/Starsilk_Character_Dossier/entities/chronology/",
      "display_label": "Reality begins as betrayal. The future is built by exclusion.",
      "incoming_count": 0,
      "observatory_url": "https://westkitty.github.io/Starsilk_Character_Dossier/relationships/#entity-chronology",
      "outgoing_count": 14,
      "stable_id": "chronology"
    },
    {
      "canonical_url": "https://westkitty.github.io/Starsilk_Character_Dossier/entities/shard-god/",
      "display_label": "Shard-God Tiger",
      "incoming_count": 1,
      "observatory_url": "https://westkitty.github.io/Starsilk_Character_Dossier/relationships/#entity-shard-god",
      "outgoing_count": 3,
      "stable_id": "shard-god"
    },
    {
      "canonical_url": "https://westkitty.github.io/Starsilk_Character_Dossier/entities/codec/",
      "display_label": "Codec",
      "incoming_count": 17,
      "observatory_url": "https://westkitty.github.io/Starsilk_Character_Dossier/relationships/#entity-codec",
      "outgoing_count": 5,
      "stable_id": "codec"
    },
    {
      "canonical_url": "https://westkitty.github.io/Starsilk_Character_Dossier/entities/dao/",
      "display_label": "Dao",
      "incoming_count": 11,
      "observatory_url": "https://westkitty.github.io/Starsilk_Character_Dossier/relationships/#entity-dao",
      "outgoing_count": 0,
      "stable_id": "dao"
    },
    {
      "canonical_url": "https://westkitty.github.io/Starsilk_Character_Dossier/entities/kail/",
      "display_label": "Kail",
      "incoming_count": 12,
      "observatory_url": "https://westkitty.github.io/Starsilk_Character_Dossier/relationships/#entity-kail",
      "outgoing_count": 3,
      "stable_id": "kail"
    },
    {
      "canonical_url": "https://westkitty.github.io/Starsilk_Character_Dossier/entities/marcel/",
      "display_label": "Marcel",
      "incoming_count": 12,
      "observatory_url": "https://westkitty.github.io/Starsilk_Character_Dossier/relationships/#entity-marcel",
      "outgoing_count": 5,
      "stable_id": "marcel"
    },
    {
      "canonical_url": "https://westkitty.github.io/Starsilk_Character_Dossier/entities/jazen/",
      "display_label": "Jazen",
      "incoming_count": 8,
      "observatory_url": "https://westkitty.github.io/Starsilk_Character_Dossier/relationships/#entity-jazen",
      "outgoing_count": 1,
      "stable_id": "jazen"
    },
    {
      "canonical_url": "https://westkitty.github.io/Starsilk_Character_Dossier/entities/starsilk-material/",
      "display_label": "Starsilk",
      "incoming_count": 0,
      "observatory_url": "https://westkitty.github.io/Starsilk_Character_Dossier/relationships/#entity-starsilk-material",
      "outgoing_count": 0,
      "stable_id": "starsilk-material"
    },
    {
      "canonical_url": "https://westkitty.github.io/Starsilk_Character_Dossier/entities/gorevault/",
      "display_label": "Gorevault",
      "incoming_count": 5,
      "observatory_url": "https://westkitty.github.io/Starsilk_Character_Dossier/relationships/#entity-gorevault",
      "outgoing_count": 0,
      "stable_id": "gorevault"
    },
    {
      "canonical_url": "https://westkitty.github.io/Starsilk_Character_Dossier/entities/ringthroat/",
      "display_label": "Ringthroat",
      "incoming_count": 5,
      "observatory_url": "https://westkitty.github.io/Starsilk_Character_Dossier/relationships/#entity-ringthroat",
      "outgoing_count": 0,
      "stable_id": "ringthroat"
    },
    {
      "canonical_url": "https://westkitty.github.io/Starsilk_Character_Dossier/entities/lyriboris/",
      "display_label": "Lyriboris",
      "incoming_count": 6,
      "observatory_url": "https://westkitty.github.io/Starsilk_Character_Dossier/relationships/#entity-lyriboris",
      "outgoing_count": 0,
      "stable_id": "lyriboris"
    },
    {
      "canonical_url": "https://westkitty.github.io/Starsilk_Character_Dossier/entities/drakken-registry/",
      "display_label": "The full field register.",
      "incoming_count": 0,
      "observatory_url": "https://westkitty.github.io/Starsilk_Character_Dossier/relationships/#entity-drakken-registry",
      "outgoing_count": 0,
      "stable_id": "drakken-registry"
    },
    {
      "canonical_url": "https://westkitty.github.io/Starsilk_Character_Dossier/entities/drk-the-egg/",
      "display_label": "The Egg",
      "incoming_count": 0,
      "observatory_url": "https://westkitty.github.io/Starsilk_Character_Dossier/relationships/#entity-drk-the-egg",
      "outgoing_count": 0,
      "stable_id": "drk-the-egg"
    },
    {
      "canonical_url": "https://westkitty.github.io/Starsilk_Character_Dossier/entities/drk-magma-pleuron/",
      "display_label": "Magma Pleuron",
      "incoming_count": 0,
      "observatory_url": "https://westkitty.github.io/Starsilk_Character_Dossier/relationships/#entity-drk-magma-pleuron",
      "outgoing_count": 0,
      "stable_id": "drk-magma-pleuron"
    },
    {
      "canonical_url": "https://westkitty.github.io/Starsilk_Character_Dossier/entities/drk-granithelion/",
      "display_label": "Granithelion",
      "incoming_count": 1,
      "observatory_url": "https://westkitty.github.io/Starsilk_Character_Dossier/relationships/#entity-drk-granithelion",
      "outgoing_count": 0,
      "stable_id": "drk-granithelion"
    },
    {
      "canonical_url": "https://westkitty.github.io/Starsilk_Character_Dossier/entities/drk-fault-tongue/",
      "display_label": "Fault-Tongue",
      "incoming_count": 3,
      "observatory_url": "https://westkitty.github.io/Starsilk_Character_Dossier/relationships/#entity-drk-fault-tongue",
      "outgoing_count": 0,
      "stable_id": "drk-fault-tongue"
    },
    {
      "canonical_url": "https://westkitty.github.io/Starsilk_Character_Dossier/entities/drk-obsidian-gul/",
      "display_label": "Obsidian Gul",
      "incoming_count": 3,
      "observatory_url": "https://westkitty.github.io/Starsilk_Character_Dossier/relationships/#entity-drk-obsidian-gul",
      "outgoing_count": 0,
      "stable_id": "drk-obsidian-gul"
    },
    {
      "canonical_url": "https://westkitty.github.io/Starsilk_Character_Dossier/entities/drk-tremorhound/",
      "display_label": "Tremorhound",
      "incoming_count": 0,
      "observatory_url": "https://westkitty.github.io/Starsilk_Character_Dossier/relationships/#entity-drk-tremorhound",
      "outgoing_count": 0,
      "stable_id": "drk-tremorhound"
    },
    {
      "canonical_url": "https://westkitty.github.io/Starsilk_Character_Dossier/entities/drk-glassspine/",
      "display_label": "Glassspine",
      "incoming_count": 0,
      "observatory_url": "https://westkitty.github.io/Starsilk_Character_Dossier/relationships/#entity-drk-glassspine",
      "outgoing_count": 0,
      "stable_id": "drk-glassspine"
    },
    {
      "canonical_url": "https://westkitty.github.io/Starsilk_Character_Dossier/entities/drk-quarrymind/",
      "display_label": "Quarrymind",
      "incoming_count": 1,
      "observatory_url": "https://westkitty.github.io/Starsilk_Character_Dossier/relationships/#entity-drk-quarrymind",
      "outgoing_count": 0,
      "stable_id": "drk-quarrymind"
    },
    {
      "canonical_url": "https://westkitty.github.io/Starsilk_Character_Dossier/entities/drk-aerokarst/",
      "display_label": "Aerokarst",
      "incoming_count": 0,
      "observatory_url": "https://westkitty.github.io/Starsilk_Character_Dossier/relationships/#entity-drk-aerokarst",
      "outgoing_count": 0,
      "stable_id": "drk-aerokarst"
    },
    {
      "canonical_url": "https://westkitty.github.io/Starsilk_Character_Dossier/entities/drk-cloudmaw/",
      "display_label": "Cloudmaw",
      "incoming_count": 2,
      "observatory_url": "https://westkitty.github.io/Starsilk_Character_Dossier/relationships/#entity-drk-cloudmaw",
      "outgoing_count": 0,
      "stable_id": "drk-cloudmaw"
    },
    {
      "canonical_url": "https://westkitty.github.io/Starsilk_Character_Dossier/entities/drk-atmantid/",
      "display_label": "Atmantid",
      "incoming_count": 0,
      "observatory_url": "https://westkitty.github.io/Starsilk_Character_Dossier/relationships/#entity-drk-atmantid",
      "outgoing_count": 0,
      "stable_id": "drk-atmantid"
    },
    {
      "canonical_url": "https://westkitty.github.io/Starsilk_Character_Dossier/entities/drk-weathernode/",
      "display_label": "Weathernode",
      "incoming_count": 0,
      "observatory_url": "https://westkitty.github.io/Starsilk_Character_Dossier/relationships/#entity-drk-weathernode",
      "outgoing_count": 0,
      "stable_id": "drk-weathernode"
    },
    {
      "canonical_url": "https://westkitty.github.io/Starsilk_Character_Dossier/entities/drk-vortenbray/",
      "display_label": "Vortenbray",
      "incoming_count": 2,
      "observatory_url": "https://westkitty.github.io/Starsilk_Character_Dossier/relationships/#entity-drk-vortenbray",
      "outgoing_count": 0,
      "stable_id": "drk-vortenbray"
    },
    {
      "canonical_url": "https://westkitty.github.io/Starsilk_Character_Dossier/entities/drk-fumericus/",